### ISSUE TITLE
"ZET v1.7.11 does not forward server-first data for hosted services (SSH banner never reaches client)"

### ISSUE THREAD

**Issue by XinLok007** [openziti/ziti-tunnel-sdk-c#1218]
This is a data forwarding bug in the SDK.
check output please:

cat 06-live-capture.txt 
=== Packet Capture on Loopback (20 packets) ===
tcpdump: verbose output suppressed, use -v[v]... for full protocol decode
listening on lo, link-type EN10MB (Ethernet), snapshot length 262144 bytes
06:30:03.516274 IP 127.0.0.1.60158 > 127.0.0.1.22: Flags [S], seq 553196919, win 65495, options [mss 65495,sackOK,TS val 3845725733 ecr 0,nop,wscale 7], length 0
E..<..@.@............... ..w.........0.........
.9.%........
06:30:03.516294 IP 127.0.0.1.22 > 127.0.0.1.60158: Flags [S.], seq 1381372416, ack 553196920, win 65483, options [mss 65495,sackOK,TS val 3845725733 ecr 3845725733,nop,wscale 7], length 0
E..<..@.@.<.............RV.. ..x.....0.........
.9.%.9.%....
06:30:03.516313 IP 127.0.0.1.60158 > 127.0.0.1.22: Flags [.], ack 1, win 512, options [nop,nop,TS val 3845725733 ecr 3845725733], length 0
E..4..@.@............... ..xRV.......(.....
.9.%.9.%
06:30:03.534162 IP 127.0.0.1.22 > 127.0.0.1.60158: Flags [P.], seq 1:44, ack 1, win 512, options [nop,nop,TS val 3845725751 ecr 3845725733], length 43: SSH: SSH-2.0-OpenSSH_9.6p1 Ubuntu-3ubuntu13.13
E.._..@.@...............RV.. ..x.....S.....
.9.7.9.%SSH-2.0-OpenSSH_9.6p1 Ubuntu-3ubuntu13.13

06:30:03.534203 IP 127.0.0.1.60158 > 127.0.0.1.22: Flags [.], ack 44, win 512, options [nop,nop,TS val 3845725751 ecr 3845725751], length 0
E..4..@.@............... ..xRV.,.....(.....
.9.7.9.7
06:30:09.813072 IP 127.0.0.1.22 > 127.0.0.1.51710: Flags [F.], seq 3129183071, ack 1420284980, win 512, options [nop,nop,TS val 3845732030 ecr 3845712029], length 0
E..4.g@.@.XZ..............._T..4.....(.....
.96..8..
06:30:09.853445 IP 127.0.0.1.51710 > 127.0.0.1.22: Flags [.], ack 1, win 512, options [nop,nop,TS val 3845732071 ecr 3845732030], length 0
E..4..@.@.>.............T..4...`.....(.....
.96..96.
06:30:17.796606 IP 127.0.0.1.45562 > 127.0.0.1.22: Flags [.], ack 3139995083, win 512, options [nop,nop,TS val 3845740014 ecr 3845676526], length 0
E..4..@.@..<..............	x.(.......(.....
.9U..8].
06:30:17.796650 IP 127.0.0.1.22 > 127.0.0.1.45562: Flags [R], seq 3139995083, win 0, length 0
E..(..@.@.<..............(......P.......
06:30:23.535860 IP 127.0.0.1.22 > 127.0.0.1.60158: Flags [F.], seq 44, ack 1, win 512, options [nop,nop,TS val 3845745753 ecr 3845725751], length 0
E..4..@.@...............RV., ..x.....(.....
.9lY.9.7
06:30:23.576462 IP 127.0.0.1.60158 > 127.0.0.1.22: Flags [.], ack 45, win 512, options [nop,nop,TS val 3845745794 ecr 3845745753], length 0
E..4..@.@............... ..xRV.-.....(.....
.9l..9lY

11 packets captured
22 packets received by filter
0 packets dropped by kernel
Capture completed/timeout
